{
  "id": "ev_ghost_001",
  "schema_version": "1.0",
  "kind": "ci_test_result",
  "title": "CI integration test run for commit def456",
  "description": "CI test report submitted as evidence for the completion claim. It targets commit def456, not the claimed commit abc123.",
  "source_system_id": "sys_ghost_factory_demo",
  "source_ref": "https://ci.example.invalid/ghost-factory-demo/runs/9821",
  "locator": "job:required-integration#L1-L200",
  "captured_at": "2026-10-19T09:55:00Z",
  "valid_from": "2026-10-19T09:55:00Z",
  "content_hash": "sha256:e3b0c44298fc1c149afbf4c8996fb92427ae41e4649b934ca495991b7852b855",
  "integrity_method": "hash",
  "producer_identity": {
    "id": "sys_ghost_factory_demo",
    "kind": "service",
    "display_name": "Ghost Factory CI reporter"
  },
  "verification": {
    "result": "verified",
    "method": "sha256",
    "verified_at": "2026-10-19T09:55:05Z",
    "verified_by": "nyx-registry",
    "notes": "Stored bytes match the recorded digest. This establishes integrity of the stored record, not that the test result is true or that it applies to another commit."
  },
  "relevance_to_claim": "claim_ghost_0001",
  "relevance_note": "Offered by the target as support for the completion claim.",
  "limitations": [
    "The test run targets commit def456, not the claimed commit abc123.",
    "CI record authenticity has not been independently verified.",
    "A passing integration run does not cover untested code paths."
  ],
  "sensitivity": "internal",
  "access_policy_ref": "policy:evidence-internal-read",
  "retention_class": "standard"
}
